{
  "probes": [
    {
      "name": "server:01j9zq4c5m8w3x2y1v0t9s8r7p",
      "kind": "server",
      "host": "10.90.0.2",
      "port": 22
    },
    {
      "name": "db:01j9zq4c5m8w3x2y1v0t9s8r7n",
      "kind": "database",
      "host": "127.0.0.1",
      "port": 15432
    }
  ],
  "names": [
    {
      "address": "10.90.0.2",
      "port": 0,
      "name": "server:01j9zq4c5m8w3x2y1v0t9s8r7p"
    },
    {
      "address": "203.0.113.7",
      "port": 0,
      "name": "server:01j9zq4c5m8w3x2y1v0t9s8r7p"
    },
    {
      "address": "10.90.0.2",
      "port": 15432,
      "name": "db:01j9zq4c5m8w3x2y1v0t9s8r7n"
    }
  ],
  "wireguard": [
    {
      "public_key": "xTIBA5rboUvnH4htodjb6e697QjLERt1NAB4mZqp8Dg=",
      "name": "server:01j9zq4c5m8w3x2y1v0t9s8r7p"
    }
  ],
  "long_lived_after_s": 60
}
